{
  "schemaVersion": 1,
  "documentType": "lesson-week",
  "packageVersion": "1.0.0",
  "courseId": "survival-travel-american-4w",
  "week": 2,
  "lessons": [
    {
      "lessonId": "w2d8-restaurant-seating",
      "recommendedDay": 8,
      "titleZh": "餐厅入座与看菜单",
      "sceneIds": ["restaurant"],
      "observableObjectives": [
        "说明用餐人数和预订姓名。",
        "听懂等位时间并索取菜单。"
      ],
      "learningUnits": [
        {
          "learningUnitId": "st4w-w2d8-vocabulary",
          "contentRef": "lesson://survival-travel-american-4w/1.0.0/w2d8/vocabulary",
          "domain": "vocabulary",
          "difficultyLevel": 2,
          "estimatedSeconds": 900,
          "tags": ["scene:restaurant", "week:2", "day:8", "focus:seating"],
          "prerequisiteUnitIds": ["st4w-w1d7-vocabulary"],
          "activity": {
            "type": "vocabulary-set",
            "instructionsZh": "把人数、预订和等位信息组成入座对话。",
            "items": [
              {"id": "w2d8-v1", "term": "table", "partOfSpeech": "noun", "meaningZh": "餐桌；一桌座位", "exampleEn": "We need a table for three.", "exampleZh": "我们需要一张三人桌。"},
              {"id": "w2d8-v2", "term": "reservation", "partOfSpeech": "noun", "meaningZh": "预订", "exampleEn": "I have a reservation at seven.", "exampleZh": "我预订了七点的位置。"},
              {"id": "w2d8-v3", "term": "menu", "partOfSpeech": "noun", "meaningZh": "菜单", "exampleEn": "Could we see the menu?", "exampleZh": "我们可以看一下菜单吗？"},
              {"id": "w2d8-v4", "term": "server", "partOfSpeech": "noun", "meaningZh": "餐厅服务员", "exampleEn": "Your server will be here soon.", "exampleZh": "您的服务员很快就来。"},
              {"id": "w2d8-v5", "term": "available", "partOfSpeech": "adjective", "meaningZh": "有空的；可用的", "exampleEn": "A table by the window is available.", "exampleZh": "靠窗有一张空桌。"},
              {"id": "w2d8-v6", "term": "wait", "partOfSpeech": "verb", "meaningZh": "等待", "exampleEn": "The wait is about ten minutes.", "exampleZh": "大约要等十分钟。"}
            ]
          }
        },
        {
          "learningUnitId": "st4w-w2d8-listening",
          "contentRef": "lesson://survival-travel-american-4w/1.0.0/w2d8/listening",
          "domain": "listening",
          "difficultyLevel": 2.5,
          "estimatedSeconds": 900,
          "tags": ["scene:restaurant", "week:2", "day:8", "skill:detail", "focus:seating"],
          "prerequisiteUnitIds": ["st4w-w1d7-listening"],
          "activity": {
            "type": "listening-dialogue",
            "titleZh": "有预订但需要等位",
            "tts": {"locale": "en-US", "defaultRate": 0.95},
            "transcript": [
              {"speaker": "Host", "text": "Good evening. Do you have a reservation?", "translationZh": "晚上好。您有预订吗？"},
              {"speaker": "Guest", "text": "Yes, a table for three under Wu at seven.", "translationZh": "有，Wu 名下七点的三人桌。"},
              {"speaker": "Host", "text": "I found it. Your table will be ready in about ten minutes.", "translationZh": "找到了。您的桌位大约十分钟后准备好。"},
              {"speaker": "Guest", "text": "That's fine. Could we see the menus while we wait?", "translationZh": "没问题。等的时候可以先看看菜单吗？"},
              {"speaker": "Host", "text": "Of course. You can wait by the front window.", "translationZh": "当然。你们可以在前窗旁等候。"},
              {"speaker": "Guest", "text": "Thank you.", "translationZh": "谢谢。"}
            ],
            "checks": [
              {"id": "w2d8-l1", "skill": "detail", "promptZh": "预订是几人桌？", "options": ["两人", "三人", "四人"], "correctOptionIndex": 1, "rationaleZh": "客人说 a table for three。"},
              {"id": "w2d8-l2", "skill": "detail", "promptZh": "客人需要等多久？", "options": ["约五分钟", "约十分钟", "约二十分钟"], "correctOptionIndex": 1, "rationaleZh": "接待员说 in about ten minutes。"},
              {"id": "w2d8-l3", "skill": "detail", "promptZh": "客人等待时想做什么？", "options": ["先看菜单", "先点饮料", "先离开"], "correctOptionIndex": 0, "rationaleZh": "客人请求在等待时看 menus。"}
            ]
          }
        },
        {
          "learningUnitId": "st4w-w2d8-speaking",
          "contentRef": "lesson://survival-travel-american-4w/1.0.0/w2d8/speaking",
          "domain": "speaking",
          "difficultyLevel": 2.5,
          "estimatedSeconds": 900,
          "tags": ["scene:restaurant", "week:2", "day:8", "task:fixed-response", "focus:seating"],
          "prerequisiteUnitIds": ["st4w-w1d7-speaking"],
          "activity": {
            "type": "fixed-response",
            "instructionsZh": "说清人数、预订姓名和时间。",
            "prompts": [
              {
                "id": "w2d8-s1",
                "cueZh": "你们两个人，没有预订。",
                "partnerLine": "Good evening. Do you have a reservation?",
                "modelAnswer": "No. A table for two, please.",
                "acceptedAnswers": ["No. A table for two, please.", "We don't have a reservation. We need a table for two.", "No reservation. There are two of us."],
                "requiredConcepts": ["no-reservation", "two-people"]
              },
              {
                "id": "w2d8-s2",
                "cueZh": "你在 Chen 名下预订了七点的位置。",
                "partnerLine": "What name is the reservation under?",
                "modelAnswer": "It's under Chen, for seven o'clock.",
                "acceptedAnswers": ["It's under Chen, for seven o'clock.", "The reservation is under Chen at seven.", "Chen. We have a seven o'clock reservation."],
                "requiredConcepts": ["Chen", "7:00"]
              },
              {
                "id": "w2d8-s3",
                "cueZh": "等位时请求看菜单。",
                "partnerLine": "The wait is about fifteen minutes.",
                "modelAnswer": "That's fine. Could we see the menu while we wait?",
                "acceptedAnswers": ["That's fine. Could we see the menu while we wait?", "Can we have the menus while we wait?", "Could we look at a menu now?"],
                "requiredConcepts": ["menu-request"]
              }
            ]
          }
        }
      ],
      "sceneQuiz": [
        {"id": "w2d8-q1", "domain": "vocabulary", "format": "single-choice", "promptZh": "“The wait is twenty minutes.”是什么意思？", "options": ["餐厅二十分钟后关门", "需要等二十分钟", "用餐限时二十分钟"], "correctOptionIndex": 1, "rationaleZh": "餐厅接待语境中的 the wait 指等位时间。"},
        {"id": "w2d8-q2", "domain": "listening", "format": "single-choice", "audioText": "I have a reservation for four under Park at six thirty.", "promptZh": "预订信息是什么？", "options": ["Park，四人，6:30", "Park，六人，4:30", "Four，Park，6:00"], "correctOptionIndex": 0, "rationaleZh": "for four、under Park、at six thirty。"},
        {"id": "w2d8-q3", "domain": "speaking", "format": "fixed-response", "promptZh": "说明你们三个人，需要一张桌子。", "modelAnswer": "A table for three, please.", "acceptedAnswers": ["A table for three, please.", "We need a table for three.", "There are three of us."], "requiredConcepts": ["three-people"]}
      ]
    },
    {
      "lessonId": "w2d9-ordering-food",
      "recommendedDay": 9,
      "titleZh": "点餐、加减配与过敏信息",
      "sceneIds": ["restaurant"],
      "observableObjectives": [
        "点主菜、配菜和饮料。",
        "说明减配需求或一种食物过敏。"
      ],
      "learningUnits": [
        {
          "learningUnitId": "st4w-w2d9-vocabulary",
          "contentRef": "lesson://survival-travel-american-4w/1.0.0/w2d9/vocabulary",
          "domain": "vocabulary",
          "difficultyLevel": 2,
          "estimatedSeconds": 900,
          "tags": ["scene:restaurant", "week:2", "day:9", "focus:food-order"],
          "prerequisiteUnitIds": ["st4w-w2d8-vocabulary"],
          "activity": {
            "type": "vocabulary-set",
            "instructionsZh": "先识别菜品类别，再表达加减配。",
            "items": [
              {"id": "w2d9-v1", "term": "appetizer", "partOfSpeech": "noun", "meaningZh": "开胃菜；前菜", "exampleEn": "Let's share an appetizer.", "exampleZh": "我们一起吃一份前菜吧。"},
              {"id": "w2d9-v2", "term": "main dish", "partOfSpeech": "noun phrase", "meaningZh": "主菜", "exampleEn": "The chicken is my main dish.", "exampleZh": "鸡肉是我的主菜。"},
              {"id": "w2d9-v3", "term": "side", "partOfSpeech": "noun", "meaningZh": "配菜", "exampleEn": "The burger comes with one side.", "exampleZh": "汉堡配一份配菜。"},
              {"id": "w2d9-v4", "term": "without", "partOfSpeech": "preposition", "meaningZh": "不加；没有", "exampleEn": "I'd like it without onions.", "exampleZh": "我想要不加洋葱。"},
              {"id": "w2d9-v5", "term": "allergic", "partOfSpeech": "adjective", "meaningZh": "过敏的", "exampleEn": "I'm allergic to peanuts.", "exampleZh": "我对花生过敏。"},
              {"id": "w2d9-v6", "term": "substitute", "partOfSpeech": "verb", "meaningZh": "替换", "exampleEn": "Can I substitute salad for fries?", "exampleZh": "我可以把薯条换成沙拉吗？"}
            ]
          }
        },
        {
          "learningUnitId": "st4w-w2d9-listening",
          "contentRef": "lesson://survival-travel-american-4w/1.0.0/w2d9/listening",
          "domain": "listening",
          "difficultyLevel": 2.5,
          "estimatedSeconds": 900,
          "tags": ["scene:restaurant", "week:2", "day:9", "skill:detail", "skill:inference", "focus:food-order"],
          "prerequisiteUnitIds": ["st4w-w2d8-listening"],
          "activity": {
            "type": "listening-dialogue",
            "titleZh": "点汉堡并替换配菜",
            "tts": {"locale": "en-US", "defaultRate": 0.96},
            "transcript": [
              {"speaker": "Server", "text": "Are you ready to order?", "translationZh": "可以点餐了吗？"},
              {"speaker": "Guest", "text": "Yes. I'd like the turkey burger without onions.", "translationZh": "可以。我想要火鸡汉堡，不加洋葱。"},
              {"speaker": "Server", "text": "That comes with fries. Would you like a different side?", "translationZh": "它配薯条。你想换别的配菜吗？"},
              {"speaker": "Guest", "text": "Could I substitute the green salad?", "translationZh": "我可以换成蔬菜沙拉吗？"},
              {"speaker": "Server", "text": "Sure. Any food allergies?", "translationZh": "可以。有食物过敏吗？"},
              {"speaker": "Guest", "text": "Yes, I'm allergic to peanuts.", "translationZh": "有，我对花生过敏。"},